"ArchMiller A.A., Bauer E.F., Koch R.E., Wijayawardena B.K., Anil A., Kottwitz J.J., Munsterman A.S., Wilson A.E.","Formalizing the definition of meta-analysis in Molecular Ecology",2015,"Molecular Ecology","24","16",,"4042","4051",,4,10.1111/mec.13264,"https://www.scopus.com/inward/record.uri?eid=2-s2.0-84938990083&doi=10.1111%2fmec.13264&partnerID=40&md5=cf50fa751220de6e7e617ae295e0822e","School of Forestry and Wildlife Sciences, Auburn University, 3301 Duncan Dr., Auburn, AL, United States; Department of Biological Sciences, Auburn University, Auburn, AL, United States; Department of Biological Sciences, Purdue University, West Lafayette, IN, United States; School of Fisheries, Aquaculture, and Aquatic Sciences, Auburn University, Auburn, AL, United States; Department of Anatomy, Physiology, and Pharmacology, College of Veterinary Medicine, Auburn University, Auburn, AL, United States; Department of Clinical Sciences, College of Veterinary Medicine, Auburn University, Auburn, AL, United States; Division of Environmental Biology, National Science Foundation, Arlington, VA, United States","ArchMiller, A.A., School of Forestry and Wildlife Sciences, Auburn University, 3301 Duncan Dr., Auburn, AL, United States; Bauer, E.F., Department of Biological Sciences, Auburn University, Auburn, AL, United States; Koch, R.E., Department of Biological Sciences, Auburn University, Auburn, AL, United States; Wijayawardena, B.K., Department of Biological Sciences, Purdue University, West Lafayette, IN, United States; Anil, A., School of Fisheries, Aquaculture, and Aquatic Sciences, Auburn University, Auburn, AL, United States; Kottwitz, J.J., Department of Anatomy, Physiology, and Pharmacology, College of Veterinary Medicine, Auburn University, Auburn, AL, United States; Munsterman, A.S., Department of Clinical Sciences, College of Veterinary Medicine, Auburn University, Auburn, AL, United States; Wilson, A.E., School of Fisheries, Aquaculture, and Aquatic Sciences, Auburn University, Auburn, AL, United States, Division of Environmental Biology, National Science Foundation, Arlington, VA, United States","Meta-analysis, the statistical synthesis of pertinent literature to develop evidence-based conclusions, is relatively new to the field of molecular ecology, with the first meta-analysis published in the journal Molecular Ecology in 2003 (Slate & Phua 2003). The goal of this article is to formalize the definition of meta-analysis for the authors, editors, reviewers and readers of Molecular Ecology by completing a review of the meta-analyses previously published in this journal. We also provide a brief overview of the many components required for meta-analysis with a more specific discussion of the issues related to the field of molecular ecology, including the use and statistical considerations of Wright's F<inf>ST</inf> and its related analogues as effect sizes in meta-analysis. We performed a literature review to identify articles published as 'meta-analyses' in Molecular Ecology, which were then evaluated by at least two reviewers. We specifically targeted Molecular Ecology publications because as a flagship journal in this field, meta-analyses published in Molecular Ecology have the potential to set the standard for meta-analyses in other journals. We found that while many of these reviewed articles were strong meta-analyses, others failed to follow standard meta-analytical techniques. One of these unsatisfactory meta-analyses was in fact a secondary analysis. Other studies attempted meta-analyses but lacked the fundamental statistics that are considered necessary for an effective and powerful meta-analysis. By drawing attention to the inconsistency of studies labelled as meta-analyses, we emphasize the importance of understanding the components of traditional meta-analyses to fully embrace the strengths of quantitative data synthesis in the field of molecular ecology. © 2015 John Wiley & Sons Ltd.","data synthesis; effect size; F<inf>ST</inf>; meta-analyses; quantitative review; secondary analysis","ecology; meta analysis (topic); methodology; publication; publishing; standards; Ecology; Editorial Policies; Meta-Analysis as Topic; Periodicals as Topic; Research Design","ArchMiller, A.A.; School of Forestry and Wildlife Sciences, Auburn University, 3301 Duncan Dr., United States",,"Blackwell Publishing Ltd",09621083,,MOECE,26059541,"English","Mol. Ecol.",Review,Scopus,2-s2.0-84938990083
[No author name available],"Erratum: Are exotic herbivores better competitors? A meta-analysis. (Ecology 95 (30-36))",2015,"Ecology","96","6",,"1735","",,,,"https://www.scopus.com/inward/record.uri?eid=2-s2.0-84930850239&partnerID=40&md5=d29668cbb42de28b3200b933f93536bc",,"",[No abstract available],,,,,"Ecological Society of America",00129658,,ECOLA,,"English","Ecology",Erratum,Scopus,2-s2.0-84930850239
"Lajeunesse M.J.","Bias and correction for the log response ratio in ecological meta-analysis",2015,"Ecology","96","8",,"2056","2063",,19,,"https://www.scopus.com/inward/record.uri?eid=2-s2.0-84939237456&partnerID=40&md5=934f7cc4fc6e3479092f1dea1e70708e","Department of Integrative Biology, University of South Florida, 4202 East Fowler Avenue, Tampa, FL, United States","Lajeunesse, M.J., Department of Integrative Biology, University of South Florida, 4202 East Fowler Avenue, Tampa, FL, United States","Ecologists widely use the log response ratio for summarizing the outcomes of studies for meta-analysis. However, little is known about the sampling distribution of this effect size estimator. Here I show with a Monte Carlo simulation that the log response ratio is biased when quantifying the outcome of studies with small sample sizes, and can yield erroneous variance estimates when the scale of study parameters are near zero. Given these challenges, I derive and compare two new estimators that help correct this small-sample bias, and update guidelines and diagnostics for assessing when the response ratio is appropriate for ecological meta-analysis. These new bias-corrected estimators retain much of the original utility of the response ratio and are aimed to improve the quality and reliability of inferences with effect sizes based on the log ratio of two means. © 2015 by the Ecological Society of America.","Delta method; Effect size estimator; Large sample approximation; Linearity of expectation; Log ratio; Meta-analysis; Research synthesis; Small sample bias","assessment method; correction; ecological modeling; estimation method; experimental study; linearity; meta-analysis; Monte Carlo analysis; numerical model; research work; sampling; sampling bias; biological model; computer simulation; ecosystem; epidemiology; meta analysis (topic); Monte Carlo method; risk assessment; statistical analysis; statistical model; Computer Simulation; Data Interpretation, Statistical; Ecosystem; Linear Models; Meta-Analysis as Topic; Models, Biological; Monte Carlo Method; Risk Assessment; Sampling Studies","Lajeunesse, M.J.; Department of Integrative Biology, University of South Florida, 4202 East Fowler Avenue, United States",,"Ecological Society of America",00129658,,ECOLA,26405731,"English","Ecology",Article,Scopus,2-s2.0-84939237456
"Esteban R., Barrutia O., Artetxe U., Fernández-Marín B., Hernández A., García-Plazaola J.I.","Internal and external factors affecting photosynthetic pigment composition in plants: A meta-analytical approach",2015,"New Phytologist","206","1",,"268","280",,26,10.1111/nph.13186,"https://www.scopus.com/inward/record.uri?eid=2-s2.0-84923286658&doi=10.1111%2fnph.13186&partnerID=40&md5=65c415517bba3ec6fc41a1775abe7fa4","Institute of Agrobiotechnology, IdAB-CSIC-UPNA-Government of Navarre, Pamplona, Spain; Department of Plant Biology and Ecology, University of the Basque Country (UPV/EHU), c/ Sarriena s/n; apdo. 644, Bilbao, Spain; Institute of Botany and Center for Molecular Biosciences Innsbruck, University of Innsbruck, Sternwartestraße 15, Innsbruck, Spain","Esteban, R., Institute of Agrobiotechnology, IdAB-CSIC-UPNA-Government of Navarre, Pamplona, Spain; Barrutia, O., Department of Plant Biology and Ecology, University of the Basque Country (UPV/EHU), c/ Sarriena s/n; apdo. 644, Bilbao, Spain; Artetxe, U., Department of Plant Biology and Ecology, University of the Basque Country (UPV/EHU), c/ Sarriena s/n; apdo. 644, Bilbao, Spain; Fernández-Marín, B., Department of Plant Biology and Ecology, University of the Basque Country (UPV/EHU), c/ Sarriena s/n; apdo. 644, Bilbao, Spain, Institute of Botany and Center for Molecular Biosciences Innsbruck, University of Innsbruck, Sternwartestraße 15, Innsbruck, Spain; Hernández, A., Department of Plant Biology and Ecology, University of the Basque Country (UPV/EHU), c/ Sarriena s/n; apdo. 644, Bilbao, Spain; García-Plazaola, J.I., Department of Plant Biology and Ecology, University of the Basque Country (UPV/EHU), c/ Sarriena s/n; apdo. 644, Bilbao, Spain","Photosynthetic pigment composition has been a major study target in plant ecophysiology during the last three decades. Although more than 2000 papers have been published, a comprehensive evaluation of the responses of photosynthetic pigment composition to environmental conditions is not yet available. After an extensive survey, we compiled data from 525 papers including 809 species (subkingdom Viridiplantae) in which pigment composition was described. A meta-analysis was then conducted to assess the ranges of photosynthetic pigment content. Calculated frequency distributions of pigments were compared with those expected from the theoretical pigment composition. Responses to environmental factors were also analysed. The results revealed that lutein and xanthophyll cycle pigments (VAZ) were highly responsive to the environment, emphasizing the high phenotypic plasticity of VAZ, whereas neoxanthin was very stable. The present meta-analysis supports the existence of relatively narrow limits for pigment ratios and also supports the presence of a pool of free 'unbound' VAZ. Results from this study provide highly reliable ranges of photosynthetic pigment contents as a framework for future research on plant pigments. © 2014 New Phytologist Trust.","Environmental modulation; Irradiance; Meta-analytical approach; Nonstressed; Phenotypic plasticity index (PI); Photosynthetic pigments","ecophysiology; environmental conditions; environmental factor; eukaryote; irradiance; meta-analysis; phenotypic plasticity; photosynthesis; pigment; Viridiplantae; carotenoid; pigment; xanthophyll; light; meta analysis; metabolism; photosynthesis; physiology; plant; plant leaf; radiation response; Carotenoids; Light; Lutein; Photosynthesis; Pigments, Biological; Plant Leaves; Plants; Xanthophylls","Esteban, R.; Institute of Agrobiotechnology, IdAB-CSIC-UPNA-Government of NavarreSpain",,"Blackwell Publishing Ltd",0028646X,,NEPHA,25414007,"English","New Phytol.",Article,Scopus,2-s2.0-84923286658
"Mayrose I., Zhan S.H., Rothfels C.J., Arrigo N., Barker M.S., Rieseberg L.H., Otto S.P.","Methods for studying polyploid diversification and the dead end hypothesis: A reply to Soltis et al. (2014)",2015,"New Phytologist","206","1",,"27","35",,23,10.1111/nph.13192,"https://www.scopus.com/inward/record.uri?eid=2-s2.0-84923502767&doi=10.1111%2fnph.13192&partnerID=40&md5=e2e7c49803390c9a4926d5a6ece52e98","Department of Molecular Biology and Ecology of Plants, Tel Aviv University, Tel Aviv, Israel; Department of Zoology and Biodiversity Research Centre, University of British Columbia, Vancouver, BC, Canada; Department of Ecology and Evolution, University of Lausanne, Lausanne, Switzerland; Department of Ecology and Evolutionary Biology, University of Arizona, Tucson, AZ, United States; Department of Botany and Biodiversity Research Centre, University of British Columbia, Vancouver, BC, Canada","Mayrose, I., Department of Molecular Biology and Ecology of Plants, Tel Aviv University, Tel Aviv, Israel; Zhan, S.H., Department of Zoology and Biodiversity Research Centre, University of British Columbia, Vancouver, BC, Canada; Rothfels, C.J., Department of Zoology and Biodiversity Research Centre, University of British Columbia, Vancouver, BC, Canada; Arrigo, N., Department of Ecology and Evolution, University of Lausanne, Lausanne, Switzerland; Barker, M.S., Department of Ecology and Evolutionary Biology, University of Arizona, Tucson, AZ, United States; Rieseberg, L.H., Department of Botany and Biodiversity Research Centre, University of British Columbia, Vancouver, BC, Canada; Otto, S.P., Department of Zoology and Biodiversity Research Centre, University of British Columbia, Vancouver, BC, Canada",[No abstract available],"Binary-state speciation and extinction (BiSSE); Diversification; Extinction; Meta-analysis; Polyploidy; Speciation","angiosperm; evolution; fern; genetics; polyploidy; species differentiation; species extinction; Angiosperms; Biological Evolution; Extinction, Biological; Ferns; Genetic Speciation; Polyploidy","Mayrose, I.; Department of Molecular Biology and Ecology of Plants, Tel Aviv UniversityIsrael",,"Blackwell Publishing Ltd",0028646X,,NEPHA,25472785,"English","New Phytol.",Letter,Scopus,2-s2.0-84923502767
"Becker D.J., Streicker D.G., Altizer S.","Linking anthropogenic resources to wildlife-pathogen dynamics: A review and meta-analysis",2015,"Ecology Letters","18","5",,"483","495",,44,10.1111/ele.12428,"https://www.scopus.com/inward/record.uri?eid=2-s2.0-84927126395&doi=10.1111%2fele.12428&partnerID=40&md5=5949d6c4f42e7d76d3ee22ce7a3c2a7a","Odum School of Ecology, University of Georgia, Athens, GA, United States; Institute of Biodiversity, Animal Health and Comparative Medicine, University of Glasgow, Glasgow, United Kingdom; MRC-University of Glasgow Centre for Virus Research, Glasgow, United Kingdom","Becker, D.J., Odum School of Ecology, University of Georgia, Athens, GA, United States; Streicker, D.G., Odum School of Ecology, University of Georgia, Athens, GA, United States, Institute of Biodiversity, Animal Health and Comparative Medicine, University of Glasgow, Glasgow, United Kingdom, MRC-University of Glasgow Centre for Virus Research, Glasgow, United Kingdom; Altizer, S., Odum School of Ecology, University of Georgia, Athens, GA, United States","Urbanisation and agriculture cause declines for many wildlife, but some species benefit from novel resources, especially food, provided in human-dominated habitats. Resulting shifts in wildlife ecology can alter infectious disease dynamics and create opportunities for cross-species transmission, yet predicting host-pathogen responses to resource provisioning is challenging. Factors enhancing transmission, such as increased aggregation, could be offset by better host immunity due to improved nutrition. Here, we conduct a review and meta-analysis to show that food provisioning results in highly heterogeneous infection outcomes that depend on pathogen type and anthropogenic food source. We also find empirical support for behavioural and immune mechanisms through which human-provided resources alter host exposure and tolerance to pathogens. A review of recent theoretical models of resource provisioning and infection dynamics shows that changes in host contact rates and immunity produce strong non-linear responses in pathogen invasion and prevalence. By integrating results of our meta-analysis back into a theoretical framework, we find provisioning amplifies pathogen invasion under increased host aggregation and tolerance, but reduces transmission if provisioned food decreases dietary exposure to parasites. These results carry implications for wildlife disease management and highlight areas for future work, such as how resource shifts might affect virulence evolution. © 2015 The Authors. Ecology Letters published by John Wiley & Sons Ltd and CNRS.","Aggregation; Agriculture; Foraging ecology; Host-parasite interactions; Immune defence; Infectious disease ecology; Mathematical models; Supplemental feeding; Urbanisation","aggregation behavior; agricultural practice; anthropogenic source; disease control; feeding ecology; host-parasite interaction; host-pathogen interaction; immunity; management practice; meta-analysis; numerical model; pathology; urbanization; virulence; agriculture; animal; animal behavior; biological model; ecology; food chain; host parasite interaction; meta analysis; parasitology; urbanization; wild animal; Agriculture; Animals; Animals, Wild; Behavior, Animal; Ecology; Food Chain; Host-Parasite Interactions; Models, Biological; Urbanization","Becker, D.J.; Odum School of Ecology, University of GeorgiaUnited States",,"Blackwell Publishing Ltd",1461023X,,ECLEF,25808224,"English","Ecol. Lett.",Review,Scopus,2-s2.0-84927126395
"Starko S., Claman B.Z., Martone P.T.","Biomechanical consequences of branching in flexible wave-swept macroalgae",2015,"New Phytologist","206","1",,"133","140",,7,10.1111/nph.13182,"https://www.scopus.com/inward/record.uri?eid=2-s2.0-84923285019&doi=10.1111%2fnph.13182&partnerID=40&md5=15ed6f7864e6bc64b600901c7c404a93","Department of Botany and Biodiversity Research Centre, University of British Columbia, Vancouver, BC, Canada; Bamfield Marine Sciences Centre, Bamfield, BC, Canada","Starko, S., Department of Botany and Biodiversity Research Centre, University of British Columbia, Vancouver, BC, Canada, Bamfield Marine Sciences Centre, Bamfield, BC, Canada; Claman, B.Z., Department of Botany and Biodiversity Research Centre, University of British Columbia, Vancouver, BC, Canada; Martone, P.T., Department of Botany and Biodiversity Research Centre, University of British Columbia, Vancouver, BC, Canada, Bamfield Marine Sciences Centre, Bamfield, BC, Canada","Wave-swept macroalgae present an excellent system for studying the effects of chronic physical stress on the morphological evolution of plants. Wave-induced water velocities impose great drag forces, leading to a morphological tradeoff between light interception and drag reduction/tolerance. What are the hydrodynamic consequences of morphological diversification, such as increased branching? Drag was measured on artificial macroalgae of constant 'photosynthetic' area, but differing branching patterns, in a high-speed flume at water velocities up to 3.5 m s-1. A meta-analysis was used to compare dislodgement forces of branched and unbranched species of comparable sizes in the field to determine if drag-prone morphologies had greater attachment strengths. Branched fronds experienced greater drag than unbranched fronds of the same size. Greater drag in branched forms was not the result of increased projected area but probably resulted from greater pressure or friction drag. In the field, branched species resisted greater dislodgement forces than unbranched species of comparable size, suggesting that branched species compensate for increased drag with stronger attachment to the substratum. Branching has clear biomechanical consequences, increasing drag and the need for increased attachment. This raises questions about physiological and ecological advantages that may have driven the repeated evolution of biomechanically costly, branched morphologies. © 2014 New Phytologist Trust.","Biomechanics; Dislodgement; Drag; Evolution; Hydrodynamics; Intertidal; Macroalgae morphology; Reconfiguration","biomechanics; drag; evolutionary theory; hydrodynamics; macroalga; meta-analysis; morphology; physiological response; wave action; biomechanics; ecology; growth, development and aging; hydrodynamics; meta analysis; physiology; pressure; seaweed; Biomechanical Phenomena; Ecology; Hydrodynamics; Pressure; Seaweed","Martone, P.T.; Department of Botany and Biodiversity Research Centre, University of British ColumbiaCanada",,"Blackwell Publishing Ltd",0028646X,,NEPHA,25413976,"English","New Phytol.",Article,Scopus,2-s2.0-84923285019
"Hsu Y.-H., Schroeder J., Winney I., Burke T., Nakagawa S.","Are extra-pair males different from cuckolded males? A case study and a meta-analytic examination",2015,"Molecular Ecology","24","7",,"1558","1571",,17,10.1111/mec.13124,"https://www.scopus.com/inward/record.uri?eid=2-s2.0-84925450699&doi=10.1111%2fmec.13124&partnerID=40&md5=5495d1bf3d5c97b0ef432c7b08529036","Department of Zoology, University of Otago, Dunedin, New Zealand; Evolutionary Biology, Max Planck Institute for Ornithology, Seewiesen, Germany; Department of Animal and Plant Sciences, University of Sheffield, Sheffield, United Kingdom; Department of Life Science, National Taiwan Normal University, Taipei, Taiwan","Hsu, Y.-H., Department of Zoology, University of Otago, Dunedin, New Zealand, Department of Life Science, National Taiwan Normal University, Taipei, Taiwan; Schroeder, J., Evolutionary Biology, Max Planck Institute for Ornithology, Seewiesen, Germany, Department of Animal and Plant Sciences, University of Sheffield, Sheffield, United Kingdom; Winney, I., Department of Animal and Plant Sciences, University of Sheffield, Sheffield, United Kingdom; Burke, T., Department of Animal and Plant Sciences, University of Sheffield, Sheffield, United Kingdom; Nakagawa, S., Department of Zoology, University of Otago, Dunedin, New Zealand, Department of Animal and Plant Sciences, University of Sheffield, Sheffield, United Kingdom","Traditional models for female extra-pair matings assume that females benefit indirectly from extra-pair mating behaviour. Under these so-called adaptive models, extra-pair males are hypothesized to have more compatible genotypes, larger body size, exaggerated ornaments or to be older than cuckolded males. Alternatively, ('nonadaptive') models that consider female extra-pair matings to be a by-product posit that female extra-pair mating can be maintained even if there is no benefit to females. This could happen if, for example, males gained fitness benefits from extra-pair mating, while female and male extra-pair mating behaviours were genetically correlated. Extra-pair males are also expected to be older and larger if this improves their ability to convince or coerce females to mate. We investigated whether a female's extra-pair mates differed from her cuckolded mate in both genetic and phenotypic traits by analysing data from an insular house sparrow population. We found that extra-pair males were older than cuckolded males, consistent with both models. However, in contrast to the expectations from from adaptive models, extra-pair and cuckolded males were of similar genetic relatedness, and hence expected compatibility, with the female, and had comparable body size and secondary sexual traits. We also updated previous meta-analyses examining differences between extra-pair and cuckolded males. The meta-analytic results matched results from our house sparrow case study. Although we cannot completely exclude indirect benefits for females, nonadaptive models may better explain female extra-pair matings. These neglected alternative models deserve more research attention, and this should improve our understanding of the evolution of mating systems. © 2015 John Wiley & Sons Ltd.","genetic compatibility; genetic constraints; good genes; male manipulation; polyandry; sexual conflict","Passer domesticus; animal; biological model; female; genetics; male; mate choice; meta analysis; phenotype; reproductive fitness; sparrow; statistical model; Animals; Female; Genetic Fitness; Linear Models; Male; Mating Preference, Animal; Models, Genetic; Phenotype; Sparrows","Hsu, Y.-H.; Department of Zoology, University of OtagoNew Zealand",,"Blackwell Publishing Ltd",09621083,,MOECE,25706253,"English","Mol. Ecol.",Article,Scopus,2-s2.0-84925450699
"Mazza C.A., Ballaré C.L.","Photoreceptors UVR8 and phytochrome B cooperate to optimize plant growth and defense in patchy canopies",2015,"New Phytologist","207","1",,"4","9",,21,10.1111/nph.13332,"https://www.scopus.com/inward/record.uri?eid=2-s2.0-84929915319&doi=10.1111%2fnph.13332&partnerID=40&md5=7c154919b8f2191b6b936309697bd757","IFEVA, Consejo Nacional de Investigaciones Científicas y Técnicas, Universidad de Buenos Aires, Buenos Aires, Argentina; IIB-INTECH, Consejo Nacional de Investigaciones Científicas y Técnicas, Universidad Nacional de San Martín, Buenos Aires, Argentina","Mazza, C.A., IFEVA, Consejo Nacional de Investigaciones Científicas y Técnicas, Universidad de Buenos Aires, Buenos Aires, Argentina; Ballaré, C.L., IFEVA, Consejo Nacional de Investigaciones Científicas y Técnicas, Universidad de Buenos Aires, Buenos Aires, Argentina, IIB-INTECH, Consejo Nacional de Investigaciones Científicas y Técnicas, Universidad Nacional de San Martín, Buenos Aires, Argentina",[No abstract available],"Flavonoid; Herbivory; Jasmonate; Meta-analysis; Phytochrome; Red: far-red ratio; UV-B; UVR8","Arabidopsis protein; nonhistone protein; phenol derivative; phytochrome B; Uvr8 protein, Arabidopsis; Arabidopsis; growth, development and aging; metabolism; plant development; plant leaf; radiation response; signal transduction; ultraviolet radiation; Arabidopsis; Arabidopsis Proteins; Chromosomal Proteins, Non-Histone; Phenols; Phytochrome B; Plant Development; Plant Leaves; Signal Transduction; Ultraviolet Rays","Ballaré, C.L.; IIB-INTECH, Consejo Nacional de Investigaciones Científicas y Técnicas, Universidad Nacional de San MartínArgentina",,"Blackwell Publishing Ltd",0028646X,,NEPHA,25659974,"English","New Phytol.",Letter,Scopus,2-s2.0-84929915319
