"Foss-Grant A.P., Zipkin E.F., Thorson J.T., Jensen O.P., Fagan W.F.","Hierarchical analysis of taxonomic variation in intraspecific competition across fish species",2016,"Ecology","97","7",,"1724","1734",,3,10.14315/evth-2014-0202,"https://www.scopus.com/inward/record.uri?eid=2-s2.0-84990961173&doi=10.14315%2fevth-2014-0202&partnerID=40&md5=25cdb279b00d0717c64f3b25ec40f08f","University of Maryland, Department of Biology, College Park, MD, United States; Michigan State University, Department of Integrative Biology, Ecology, Evolutionary Biology and Behavior Program, East Lansing, MI, United States; Fisheries Resources Assessment and Monitoring Division, Northwest Fisheries Science Center, National Marine Fisheries Service, NOAA, Seattle, WA, United States; Rutgers University, Department of Marine and Coastal Sciences, New Brunswick, NJ, United States","Foss-Grant, A.P., University of Maryland, Department of Biology, College Park, MD, United States; Zipkin, E.F., Michigan State University, Department of Integrative Biology, Ecology, Evolutionary Biology and Behavior Program, East Lansing, MI, United States; Thorson, J.T., Fisheries Resources Assessment and Monitoring Division, Northwest Fisheries Science Center, National Marine Fisheries Service, NOAA, Seattle, WA, United States; Jensen, O.P., Rutgers University, Department of Marine and Coastal Sciences, New Brunswick, NJ, United States; Fagan, W.F., University of Maryland, Department of Biology, College Park, MD, United States","The nature and intensity of intraspecific competition can vary greatly among taxa, yet similarities in these interactions can lead to similar population dynamics among related organisms. Variation along the spectrum of intraspecific competition, with contest and scramble competition as endpoints, leads to vastly different responses to population density. Here we investigated the diversity of intraspecific competition among fish species, predicting that functional forms of density-dependent reproduction would be conserved in related taxa. Using a hierarchical model that links stock-recruitment parameters among populations, species, and orders, we found that the strength of overcompensation, and therefore the type of intraspecific competition, is tightly clustered within taxonomic groupings, as species within an order share similar degrees of compensation. Specifically, species within the orders Salmoniformes and Pleuronectiformes exhibited density dependence indicative of scramble competition (overcompensation) while the orders Clupeiformes, Gadiformes, Perciformes, and Scorpaeniformes exhibited dynamics consistent with contest competition (compensation). Maximum potential recruitment also varied among orders, but with less clustering across species. We also tested whether stock-recruitment parameters correlated with maximum body length among species, but found no strong relationship. Our results suggest that much of the variation in the form of density-dependent reproduction among fish species may be predicted taxonomically due to evolved life history traits and reproductive behaviors. © 2016 by the Ecological Society of America.","Density-dependence; Hierarchical model; Intraspecific competition; Meta-analysis; Recruitment compensation; Shepherd stock-recruitment model; Stock assessment; Stock-recruitment","clupeoid; compensation; density dependence; gadoid; hierarchical system; intraspecific competition; life history trait; meta-analysis; perciform; population density; recruitment (population dynamics); reproductive behavior; salmonid; stock assessment; taxonomy; Clupeiformes; Gadiformes; Perciformes; Pleuronectiformes; Salmoniformes; Scorpaeniformes","Foss-Grant, A.P.; University of Maryland, Department of BiologyUnited States; email: andyfg@umd.edu",,"Ecological Society of America",00129658,,ECOLA,,"English","Ecology",Article,Scopus,2-s2.0-84990961173
"Linquist S., Gregory T.R., Elliott T.A., Saylor B., Kremer S.C., Cottenie K.","Yes! there are resilient generalizations (or “laws”) in ecology",2016,"Quarterly Review of Biology","91","2",,"119","131",,1,10.1086/686809,"https://www.scopus.com/inward/record.uri?eid=2-s2.0-84969790508&doi=10.1086%2f686809&partnerID=40&md5=c9c069f1bf456720ecedb13c5d578a0e","Department of Philosophy, University of Guelph, Guelph, ON, Canada; Department of Integrative Biology, University of Guelph, Guelph, ON, Canada; School of Computer Science, University of Guelph, Guelph, ON, Canada","Linquist, S., Department of Philosophy, University of Guelph, Guelph, ON, Canada; Gregory, T.R., Department of Integrative Biology, University of Guelph, Guelph, ON, Canada; Elliott, T.A., Department of Integrative Biology, University of Guelph, Guelph, ON, Canada; Saylor, B., Department of Integrative Biology, University of Guelph, Guelph, ON, Canada; Kremer, S.C., School of Computer Science, University of Guelph, Guelph, ON, Canada; Cottenie, K., Department of Integrative Biology, University of Guelph, Guelph, ON, Canada","It is often argued that ecological communities admit of no useful generalizations or “laws” because these systems are especially prone to contingent historical events. Detractors respond that this argument assumes an overly stringent definition of laws of nature. Under a more relaxed conception, it is argued that ecological laws emerge at the level of communities and elsewhere. A brief review of this debate reveals an issue with deep philosophical roots that is unlikely to be resolved by a better understanding of generalizations in ecology. We therefore propose a strategy for transforming the conceptual question about the nature of ecological laws into a set of empirically tractable hypotheses about the relative resilience of ecological generalizations across three dimensions: taxonomy, habitat type, and scale. These hypotheses are tested using a survey of 240 meta-analyses in ecology. Our central finding is that generalizations in community ecology are just as prevalent and as resilient as those in population or ecosystem ecology. These findings should help to establish community ecology as a generality-seeking science as opposed to a science of case studies. It also supports the capacity for ecologists, working at any of the three levels, to inform matters of public policy. © 2016 by The University of Chicago Press. All rights reserved.","Community ecology; Contingency; Ecological laws; Ecological levels; Meta-analysis; Philosophy of ecology","animal; biological model; ecology; environmental aspects and related phenomena; human; philosophy; Animals; Ecological and Environmental Phenomena; Ecology; Humans; Models, Biological; Philosophy",,,"University of Chicago Press",00335770,,QRBIA,27405221,"English","Q. Rev. Biol.",Article,Scopus,2-s2.0-84969790508
"Kriengwatana B., Spierings M.J., ten Cate C.","Auditory discrimination learning in zebra finches: Effects of sex, early life conditions and stimulus characteristics",2016,"Animal Behaviour","116",,,"99","112",,3,10.1016/j.anbehav.2016.03.028,"https://www.scopus.com/inward/record.uri?eid=2-s2.0-84964334532&doi=10.1016%2fj.anbehav.2016.03.028&partnerID=40&md5=7208aa3532f9d86a8b844778eeffafe7","Department of Psychology, University of Amsterdam, Amsterdam, Netherlands; Institute for Biology Leiden (IBL), Leiden University, Leiden, Netherlands; Leiden Institute for Brain and Cognition (LIBC), Leiden University, Leiden, Netherlands","Kriengwatana, B., Department of Psychology, University of Amsterdam, Amsterdam, Netherlands, Institute for Biology Leiden (IBL), Leiden University, Leiden, Netherlands; Spierings, M.J., Institute for Biology Leiden (IBL), Leiden University, Leiden, Netherlands, Leiden Institute for Brain and Cognition (LIBC), Leiden University, Leiden, Netherlands; ten Cate, C., Institute for Biology Leiden (IBL), Leiden University, Leiden, Netherlands, Leiden Institute for Brain and Cognition (LIBC), Leiden University, Leiden, Netherlands","A meta-analysis was conducted to investigate whether sex differences, developmental history, stimulus number and/or characteristics affect the speed of auditory discrimination learning of zebra finches, Taeniopygia guttata, as tested in a Go/No-go task. Our results indicate that sex, early life conditions (brood size and juvenile body size), the number of stimuli, type of stimuli (constructed from zebra finch song elements or human speech syllables) and type of discrimination (based on phonetic characteristics or sequential structure of sounds) significantly influenced learning speed. Learning speed was faster if birds were female, reared in larger broods or were larger as juveniles. Greater numbers of stimuli and human speech-based stimuli were harder to learn than fewer stimuli and stimuli consisting of zebra finch song elements. Stimuli differing in phonetic characteristics were learned faster than those varying in structure. Additionally, there was some evidence of stable individual differences in performance across experiments. Our findings demonstrate that discrimination learning can be affected by factors that have been suspected to, but not yet definitively shown to, have impacts on learning. We suggest that examining the learning process itself in more detail by quantifying individual differences in learning strategies may provide more information on how various factors affect variation in learning abilities. © 2016 The Association for the Study of Animal Behaviour.","Developmental stress; Go/No-go; Individual differences; Meta-analysis; Sex differences","auditory cue; developmental biology; individual variation; juvenile; learning; meta-analysis; passerine; physiology; sex-related difference; song; Aves; Taeniopygia guttata","Kriengwatana, B.; Department of Psychology, University of Amsterdam, Weesperplein 4, Netherlands; email: bkrieng@alumni.uwo.ca",,"Academic Press",00033472,,ANBEA,,"English","Anim. Behav.",Article,Scopus,2-s2.0-84964334532
"Hay M.E.","Negating the plant apparency model: Rigorous tests are the fuel of progress",2016,"New Phytologist","210","3",,"770","771",,1,10.1111/nph.13953,"https://www.scopus.com/inward/record.uri?eid=2-s2.0-84971673914&doi=10.1111%2fnph.13953&partnerID=40&md5=0387ba648bbd4123a5e1a5b1e76189ef","School of Biology and Aquatic Chemical Ecolgy Center, Georgia Institute of Technology, Atlanta, GA, United States","Hay, M.E., School of Biology and Aquatic Chemical Ecolgy Center, Georgia Institute of Technology, Atlanta, GA, United States",[No abstract available],"Chemical defenses; Co-evolution; Generalist vs specialist herbivores; Meta-analyses; Plant apparency model; Plant defense; Plant-herbivore interactions; Secondary metabolites","feeding behavior; herbivory; Feeding Behavior; Herbivory","Hay, M.E.; School of Biology and Aquatic Chemical Ecolgy Center, Georgia Institute of TechnologyUnited States; email: mark.hay@biology.gatech.edu",,"Blackwell Publishing Ltd",0028646X,,NEPHA,27074398,"English","New Phytol.",Note,Scopus,2-s2.0-84971673914
"Samia D.S.M., Blumstein D.T., Stankowich T., Cooper W.E.","Fifty years of chasing lizards: New insights advance optimal escape theory",2016,"Biological Reviews","91","2",,"349","366",,10,10.1111/brv.12173,"https://www.scopus.com/inward/record.uri?eid=2-s2.0-84923101597&doi=10.1111%2fbrv.12173&partnerID=40&md5=abe31542065027a13b79e42166e1c7c3","Laboratory of Theoretical Ecology and Synthesis, Federal University of Goiás, CP. 131, Goiânia, Brazil; Department of Ecology and Evolutionary Biology, University of California, 621 Young Drive South, Los Angeles, CA, United States; Department of Biological Sciences, California State University, 1250 Bellflower Blvd., Long Beach, CA, United States; Department of Biology, Indiana University Purdue University Fort Wayne, Fort Wayne, IN, United States","Samia, D.S.M., Laboratory of Theoretical Ecology and Synthesis, Federal University of Goiás, CP. 131, Goiânia, Brazil; Blumstein, D.T., Department of Ecology and Evolutionary Biology, University of California, 621 Young Drive South, Los Angeles, CA, United States; Stankowich, T., Department of Biological Sciences, California State University, 1250 Bellflower Blvd., Long Beach, CA, United States; Cooper, W.E., Department of Biology, Indiana University Purdue University Fort Wayne, Fort Wayne, IN, United States","Systematic reviews and meta-analyses often examine data from diverse taxa to identify general patterns of effect sizes. Meta-analyses that focus on identifying generalisations in a single taxon are also valuable because species in a taxon are more likely to share similar unique constraints. We conducted a comprehensive phylogenetic meta-analysis of flight initiation distance in lizards. Flight initiation distance (FID) is a common metric used to quantify risk-taking and has previously been shown to reflect adaptive decision-making. The past decade has seen an explosion of studies focused on quantifying FID in lizards, and, because lizards occur in a wide range of habitats, are ecologically diverse, and are typically smaller and differ physiologically from the better studied mammals and birds, they are worthy of detailed examination. We found that variables that reflect the costs or benefits of flight (being engaged in social interactions, having food available) as well as certain predator effects (predator size and approach speed) had large effects on FID in the directions predicted by optimal escape theory. Variables that were associated with morphology (with the exception of crypsis) and physiology had relatively small effects, whereas habitat selection factors typically had moderate to large effect sizes. Lizards, like other taxa, are very sensitive to the costs of flight. Biological Reviews © 2016 Cambridge Philosophical Society.","Antipredator behaviour; Escape behaviour; Escape distance; Flight initiation distance; Lizards; Meta-analysis; Optimal escape theory; Phylogenetic meta-analysis","animal; ecosystem; escape behavior; lizard; physiology; running; Animals; Ecosystem; Escape Reaction; Lizards; Running","Samia, D.S.M.; Laboratory of Theoretical Ecology and Synthesis, Federal University of Goiás, CP. 131, Brazil; email: diogosamia@gmail.com",,"Blackwell Publishing Ltd",14647931,,,25620002,"English","Biol. Rev.",Article,Scopus,2-s2.0-84923101597
"Smilanich A.M., Fincher R.M., Dyer L.A.","Does plant apparency matter? Thirty years of data provide limited support but reveal clear patterns of the effects of plant chemistry on herbivores",2016,"New Phytologist","210","3",,"1044","1057",,8,10.1111/nph.13875,"https://www.scopus.com/inward/record.uri?eid=2-s2.0-84959109504&doi=10.1111%2fnph.13875&partnerID=40&md5=e3646e4d1dd2c950145fe938abb4a0dc","Department of Biology, University of Nevada, 1664 N. Virginia St, Reno, NV, United States; Department of Biology, Samford University, 800 Lakeshore Dr., Birmingham, AL, United States","Smilanich, A.M., Department of Biology, University of Nevada, 1664 N. Virginia St, Reno, NV, United States; Fincher, R.M., Department of Biology, Samford University, 800 Lakeshore Dr., Birmingham, AL, United States; Dyer, L.A., Department of Biology, University of Nevada, 1664 N. Virginia St, Reno, NV, United States","According to the plant-apparency hypothesis, apparent plants allocate resources to quantitative defenses that negatively affect generalist and specialist herbivores, while unapparent plants invest more in qualitative defenses that negatively affect nonadapted generalists. Although this hypothesis has provided a useful framework for understanding the evolution of plant chemical defense, there are many inconsistencies surrounding associated predictions, and it has been heavily criticized and deemed obsolete. We used a hierarchical Bayesian meta-analysis model to test whether defenses from apparent and unapparent plants differ in their effects on herbivores. We collected a total of 225 effect sizes from 158 published papers in which the effects of plant chemistry on herbivore performance were reported. As predicted by the plant-apparency hypothesis, we found a prevalence of quantitative defenses in woody plants and qualitative defenses in herbaceous plants. However, the detrimental impacts of qualitative defenses were more effective against specialists than generalists, and the effects of chemical defenses did not significantly differ between specialists and generalists for woody or herbaceous plants. A striking pattern that emerged from our data was a pervasiveness of beneficial effects of secondary metabolites on herbivore performance, especially generalists. This pattern provides evidence that herbivores are evolving effective counteradaptations to putative plant defenses. © 2016 New Phytologist Trust.","Bayesian meta-analysis; Herbivory; Plant defense theory; Plant-apparency hypothesis; Secondary metabolites","Bayesian analysis; data acquisition; ecological theory; hypothesis testing; meta-analysis; performance assessment; phytochemistry; plant defense; plant-herbivore interaction; secondary metabolite; specialist; temporal analysis; adaptation; Bayes theorem; biological model; chemistry; herbivory; immunology; physiology; plant; wood; Adaptation, Physiological; Bayes Theorem; Herbivory; Models, Biological; Plants; Wood","Smilanich, A.M.; Department of Biology, University of Nevada, 1664 N. Virginia St, United States; email: asmilanich@unr.edu",,"Blackwell Publishing Ltd",0028646X,,NEPHA,26889654,"English","New Phytol.",Article,Scopus,2-s2.0-84959109504
"Alice Boyle W., Sandercock B.K., Martin K.","Patterns and drivers of intraspecific variation in avian life history along elevational gradients: A meta-analysis",2016,"Biological Reviews","91","2",,"469","482",,7,10.1111/brv.12180,"https://www.scopus.com/inward/record.uri?eid=2-s2.0-84924657051&doi=10.1111%2fbrv.12180&partnerID=40&md5=31fdfdc14aee92f422ae2b0b700603e7","Division of Biology, Kansas State University, 116 Ackert Hall, Manhattan, KS, United States; Department of Forest and Conservation Sciences, Centre for Applied Conservation Biology, University of British Columbia, 3004-2424 Main Mall, Vancouver, BC, Canada; Environment Canada, 5421 Robertson Road, Delta, BC, Canada","Alice Boyle, W., Division of Biology, Kansas State University, 116 Ackert Hall, Manhattan, KS, United States, Department of Forest and Conservation Sciences, Centre for Applied Conservation Biology, University of British Columbia, 3004-2424 Main Mall, Vancouver, BC, Canada; Sandercock, B.K., Division of Biology, Kansas State University, 116 Ackert Hall, Manhattan, KS, United States; Martin, K., Department of Forest and Conservation Sciences, Centre for Applied Conservation Biology, University of British Columbia, 3004-2424 Main Mall, Vancouver, BC, Canada, Environment Canada, 5421 Robertson Road, Delta, BC, Canada","Elevational gradients provide powerful natural systems for testing hypotheses regarding the role of environmental variation in the evolution of life-history strategies. Case studies have revealed shifts towards slower life histories in organisms living at high elevations yet no synthetic analyses exist of elevational variation in life-history traits for major vertebrate clades. We examined (i) how life-history traits change with elevation in paired populations of bird species worldwide, and (ii) which biotic and abiotic factors drive elevational shifts in life history. Using three analytical methods, we found that fecundity declined at higher elevations due to smaller clutches and fewer reproductive attempts per year. By contrast, elevational differences in traits associated with parental investment or survival varied among studies. High-elevation populations had shorter and later breeding seasons, but longer developmental periods implying that temporal constraints contribute to reduced fecundity. Analyses of clutch size data, the trait for which we had the largest number of population comparisons, indicated no evidence that phylogenetic history constrained species-level plasticity in trait variation associated with elevational gradients. The magnitude of elevational shifts in life-history traits were largely unrelated to geographic (altitude, latitude), intrinsic (body mass, migratory status), or habitat covariates. Meta-population structure, methodological issues associated with estimating survival, or processes shaping range boundaries could potentially explain the nature of elevational shifts in life-history traits evident in this data set. We identify a new risk factor for montane populations in changing climates: low fecundity will result in lower reproductive potential to recover from perturbations, especially as fewer than half of the species experienced higher survival at higher elevations. Biological Reviews © 2016 Cambridge Philosophical Society.","Alpine; Climate change; Demography; Fecundity; Hedge's d; Interspecific competition; Lack's hypothesis; Montane; Productivity; Species range limits","altitude; animal; animal dispersal; bird; genetics; meta analysis; phylogeny; physiology; reproduction; species difference; Altitude; Animal Distribution; Animals; Birds; Phylogeny; Reproduction; Species Specificity","Alice Boyle, W.; Division of Biology, Kansas State University, 116 Ackert Hall, United States; email: aboyle@ksu.edu",,"Blackwell Publishing Ltd",14647931,,,25765584,"English","Biol. Rev.",Article,Scopus,2-s2.0-84924657051
"Blount J.D., Vitikainen E.I.K., Stott I., Cant M.A.","Oxidative shielding and the cost of reproduction",2016,"Biological Reviews","91","2",,"483","497",,20,10.1111/brv.12179,"https://www.scopus.com/inward/record.uri?eid=2-s2.0-84924692454&doi=10.1111%2fbrv.12179&partnerID=40&md5=9d5466e5fb46d9621155b98559af3984","Centre for Ecology and Conservation, College of Life and Environmental Sciences, University of Exeter, Penryn Campus, Cornwall, United Kingdom; Environment and Sustainability Institute, University of Exeter, Penryn Campus, Cornwall, United Kingdom","Blount, J.D., Centre for Ecology and Conservation, College of Life and Environmental Sciences, University of Exeter, Penryn Campus, Cornwall, United Kingdom; Vitikainen, E.I.K., Centre for Ecology and Conservation, College of Life and Environmental Sciences, University of Exeter, Penryn Campus, Cornwall, United Kingdom; Stott, I., Environment and Sustainability Institute, University of Exeter, Penryn Campus, Cornwall, United Kingdom; Cant, M.A., Centre for Ecology and Conservation, College of Life and Environmental Sciences, University of Exeter, Penryn Campus, Cornwall, United Kingdom","Life-history theory assumes that reproduction and lifespan are constrained by trade-offs which prevent their simultaneous increase. Recently, there has been considerable interest in the possibility that this cost of reproduction is mediated by oxidative stress. However, empirical tests of this theory have yielded equivocal support. We carried out a meta-analysis to examine associations between reproduction and oxidative damage across markers and tissues. We show that oxidative damage is positively associated with reproductive effort across females of various species. Yet paradoxically, categorical comparisons of breeders versus non-breeders reveal that transition to the reproductive state is associated with a step-change reduction in oxidative damage in certain tissues and markers. Developing offspring may be particularly sensitive to harm caused by oxidative damage in mothers. Therefore, such reductions could potentially function to shield reproducing mothers, gametes and developing offspring from oxidative insults that inevitably increase as a consequence of reproductive effort. According to this perspective, we hypothesise that the cost of reproduction is mediated by dual impacts of maternally-derived oxidative damage on mothers and offspring, and that mothers may be selected to diminish such damage. Such oxidative shielding may explain why many existing studies have concluded that reproduction has little or no oxidative cost. Future advance in life-history theory therefore needs to take account of potential transgenerational impacts of the mechanisms underlying life-history trade-offs. Biological Reviews © 2016 Cambridge Philosophical Society.","Ageing; Fetal programming; Life-history trade-off; Oxidative shielding hypothesis; Oxidative stress; Reactive oxygen species","reactive oxygen metabolite; animal; female; meta analysis; oxidative stress; physiology; reproduction; Animals; Female; Oxidative Stress; Reactive Oxygen Species; Reproduction","Blount, J.D.; Centre for Ecology and Conservation, College of Life and Environmental Sciences, University of Exeter, Penryn Campus, United Kingdom; email: j.d.blount@exeter.ac.uk",,"Blackwell Publishing Ltd",14647931,,,25765468,"English","Biol. Rev.",Article,Scopus,2-s2.0-84924692454
