"Ameye M., Allmann S., Verwaeren J., Smagghe G., Haesaert G., Schuurink R.C., Audenaert K.","Green leaf volatile production by plants: A meta-analysis",2017,"New Phytologist",,,,"","",,1,10.1111/nph.14671,"https://www.scopus.com/inward/record.uri?eid=2-s2.0-85021651041&doi=10.1111%2fnph.14671&partnerID=40&md5=1c89b7cbcb62dd0b3b61f98ac7cf9c1d","Department of Applied Bioscience Faculty of Bioscience Engineering Ghent University Valentin Vaerwyckweg 1 B-9000 Ghent Belgium; Department of Crop Protection Faculty of Bioscience Engineering Ghent University Coupure Links 653 B-9000 Ghent Belgium; Department of Plant Physiology Swammerdam Institute for Life Sciences University of Amsterdam PO Box 94215 1090 GE Amsterdam the Netherlands","Ameye, M., Department of Applied Bioscience Faculty of Bioscience Engineering Ghent University Valentin Vaerwyckweg 1 B-9000 Ghent Belgium, Department of Crop Protection Faculty of Bioscience Engineering Ghent University Coupure Links 653 B-9000 Ghent Belgium; Allmann, S., Department of Plant Physiology Swammerdam Institute for Life Sciences University of Amsterdam PO Box 94215 1090 GE Amsterdam the Netherlands; Verwaeren, J., Department of Applied Bioscience Faculty of Bioscience Engineering Ghent University Valentin Vaerwyckweg 1 B-9000 Ghent Belgium; Smagghe, G., Department of Crop Protection Faculty of Bioscience Engineering Ghent University Coupure Links 653 B-9000 Ghent Belgium; Haesaert, G., Department of Applied Bioscience Faculty of Bioscience Engineering Ghent University Valentin Vaerwyckweg 1 B-9000 Ghent Belgium; Schuurink, R.C., Department of Plant Physiology Swammerdam Institute for Life Sciences University of Amsterdam PO Box 94215 1090 GE Amsterdam the Netherlands; Audenaert, K., Department of Applied Bioscience Faculty of Bioscience Engineering Ghent University Valentin Vaerwyckweg 1 B-9000 Ghent Belgium","I. II. III. IV. V. VI. VII. VIII. IX. X. XI. XII. XIII. References Summary: Plants respond to stress by releasing biogenic volatile organic compounds (BVOCs). Green leaf volatiles (GLVs), which are abundantly produced across the plant kingdom, comprise an important group within the BVOCs. They can repel or attract herbivores and their natural enemies; and they can induce plant defences or prime plants for enhanced defence against herbivores and pathogens and can have direct toxic effects on bacteria and fungi. Unlike other volatiles, GLVs are released almost instantly upon mechanical damage and (a)biotic stress and could thus function as an immediate and informative signal for many organisms in the plant's environment. We used a meta-analysis approach in which data from the literature on GLV production during biotic stress responses were compiled and interpreted. We identified that different types of attackers and feeding styles add a degree of complexity to the amount of emitted GLVs, compared with wounding alone. This meta-analysis illustrates that there is less variation in the GLV profile than we presumed, that pathogens induce more GLVs than insects and wounding, and that there are clear differences in GLV emission between monocots and dicots. Besides the meta-analysis, this review provides an update on recent insights into the perception and signalling of GLVs in plants. © 2017 New Phytologist Trust.","Dicot; Fungus; Green leaf volatile (GLV); Herbivore; Meta-analysis; Monocot; Pathogen",,"Schuurink, R.C.email: R.C.Schuurink@uva.nl",,"Blackwell Publishing Ltd",0028646X,,NEPHA,,"English","New Phytol.",Article in Press,Scopus,2-s2.0-85021651041
"Vidal M.C., Murphy S.M.","Bottom-up vs. top-down effects on terrestrial insect herbivores: A meta-analysis",2017,"Ecology Letters",,,,"","",,,10.1111/ele.12874,"https://www.scopus.com/inward/record.uri?eid=2-s2.0-85032841021&doi=10.1111%2fele.12874&partnerID=40&md5=b7b500210307ad6b1074808c804e614b","Department of Biological Sciences, University of Denver, Denver, CO USA","Vidal, M.C., Department of Biological Sciences, University of Denver, Denver, CO USA; Murphy, S.M., Department of Biological Sciences, University of Denver, Denver, CO USA","Primary consumers are under strong selection from resource ('bottom-up') and consumer ('top-down') controls, but the relative importance of these selective forces is unknown. We performed a meta-analysis to compare the strength of top-down and bottom-up forces on consumer fitness, considering multiple predictors that can modulate these effects: diet breadth, feeding guild, habitat/environment, type of bottom-up effects, type of top-down effects and how consumer fitness effects are measured. We focused our analyses on the most diverse group of primary consumers, herbivorous insects, and found that in general top-down forces were stronger than bottom-up forces. Notably, chewing, sucking and gall-making herbivores were more affected by top-down than bottom-up forces, top-down forces were stronger than bottom-up in both natural and controlled (cultivated) environments, and parasitoids and predators had equally strong top-down effects on insect herbivores. Future studies should broaden the scope of focal consumers, particularly in understudied terrestrial systems, guilds, taxonomic groups and top-down controls (e.g. pathogens), and test for more complex indirect community interactions. Our results demonstrate the surprising strength of forces exerted by natural enemies on herbivorous insects, and thus the necessity of using a tri-trophic approach when studying insect-plant interactions. © 2017 John Wiley & Sons Ltd/CNRS.","Bottom-up; Fitness; Herbivorous insects; Host-plant quality; Meta-analysis; Natural enemies; Parasitoid; Predator; Top-down",,"Vidal, M.C.email: mayra.vidal@du.edu",,"Blackwell Publishing Ltd",1461023X,,ECLEF,,"English","Ecol. Lett.",Article in Press,Scopus,2-s2.0-85032841021
"Deng Q., McMahon D.E., Xiang Y., Yu C.-L., Jackson R.B., Hui D.","A global meta-analysis of soil phosphorus dynamics after afforestation",2017,"New Phytologist","213","1",,"181","192",,4,10.1111/nph.14119,"https://www.scopus.com/inward/record.uri?eid=2-s2.0-84980019060&doi=10.1111%2fnph.14119&partnerID=40&md5=f56afda9a86866902f23b30a6e69d445","Department of Biological Sciences, Tennessee State University, Nashville, TN, United States; Key Laboratory of Aquatic Botany and Watershed Ecology, Wuhan Botanical Garden, Chinese Academy of Sciences, Wuhan, China; Department of Earth System Science, Stanford University, Stanford, CA, United States; Guizhou Institute of Forest Inventory and Planning, Guiyang, China","Deng, Q., Department of Biological Sciences, Tennessee State University, Nashville, TN, United States, Key Laboratory of Aquatic Botany and Watershed Ecology, Wuhan Botanical Garden, Chinese Academy of Sciences, Wuhan, China; McMahon, D.E., Department of Earth System Science, Stanford University, Stanford, CA, United States; Xiang, Y., Guizhou Institute of Forest Inventory and Planning, Guiyang, China; Yu, C.-L., Department of Biological Sciences, Tennessee State University, Nashville, TN, United States; Jackson, R.B., Department of Earth System Science, Stanford University, Stanford, CA, United States; Hui, D., Department of Biological Sciences, Tennessee State University, Nashville, TN, United States","Afforestation significantly affects soil chemistry and biota, but its effects on the potentially growth-limiting nutrient phosphorus (P) had not to our knowledge been analyzed globally. We conducted a comprehensive meta-analysis of 220 independent sampling sites from 108 articles to evaluate global patterns and controls of soil P change following afforestation. Overall, total P concentration decreased by 11% and total P stock by 12% in the top 20 cm of mineral soil following afforestation, with no change in available P. Time since afforestation had no consistent effect on total P, while available P tended to increase with time. Prior land cover was the most influential factor for soil P change after afforestation, with available P increasing on native vegetation but decreasing on cropland. Afforestation increased available P by 22% without decreasing total P on formerly ‘degraded’ land, but depleted total P by 15% at nondegraded sites. Climate also influenced soil P response to afforestation, with larger P loss in the tropics. Afforestation did not appear to directly induce P limitation, as available P only decreased on cropland. However, substantial declines in total P may drive tropical plantations toward greater P limitation as the capacity to replenish available P decreases. © 2016 The Authors. New Phytologist © 2016 New Phytologist Trust","biogeochemistry; land-use change; nutrient limitation; plantations; soil available phosphorus; soil nutrients","afforestation; biogeochemistry; land cover; land use change; meta-analysis; nutrient limitation; phosphorus; soil chemistry; soil nutrient","Jackson, R.B.; Department of Earth System Science, Stanford UniversityUnited States; email: rob.jackson@stanford.edu",,"Blackwell Publishing Ltd",0028646X,,NEPHA,,"English","New Phytol.",Article,Scopus,2-s2.0-84980019060
"Lee M.R., Bernhardt E.S., van Bodegom P.M., Cornelissen J.H.C., Kattge J., Laughlin D.C., Niinemets Ü., Peñuelas J., Reich P.B., Yguel B., Wright J.P.","Invasive species’ leaf traits and dissimilarity from natives shape their impact on nitrogen cycling: a meta-analysis",2017,"New Phytologist","213","1",,"128","139",,2,10.1111/nph.14115,"https://www.scopus.com/inward/record.uri?eid=2-s2.0-84994559204&doi=10.1111%2fnph.14115&partnerID=40&md5=9fa757d1be8da1afe06ad9e4d87ca658","Department of Biology, Duke University, 130 Science Drive, Durham, NC, United States; Institute of Environmental Sciences, Leiden University, Einsteinweg 2, Leiden, Netherlands; Department of Ecological Science, Vrije Universiteit Amsterdam, De Boelelaan 1085, Amsterdam, Netherlands; Max Planck Institute for Biogeochemistry, Hans Knöll Str. 10, Jena, Germany; German Centre for Integrative Biodiversity Research (iDiv) Halle-Jena-Leipzig, Deutscher Platz 5e, Leipzig, Germany; Environmental Research Institute, University of Waikato, Private Bag 3105, Hamilton, New Zealand; Department of Plant Physiology, Estonian University of Life Sciences, Kreutzwaldi 1, Tartu, Estonia; CSIC, Global Ecology Unit, CREAF-CSIC-UAB, Cerdanyola del Vallès, Barcelona, Catalonia, Spain; CREAF, Cerdanyola del Vallès, Barcelona, Catalonia, Spain; Department of Forest Resources, University of Minnesota, St Paul, MN, United States; Hawkesbury Institute for the Environment, Western Sydney University, Penrith, NSW, Australia; Unité MECADEV mécanismes adaptatifs et évolution, UMR 7179 CNRS/MNHN, 4 avenue du Petit Château, Brunoy, France; Centre d'Ecologie et des Sciences de la Conservation (CESCO-UMR 7204), Sorbonne Universités-MNHN-CNRS-UPMC, CP51, 55-61 rue Buffon, Paris, France","Lee, M.R., Department of Biology, Duke University, 130 Science Drive, Durham, NC, United States; Bernhardt, E.S., Department of Biology, Duke University, 130 Science Drive, Durham, NC, United States; van Bodegom, P.M., Institute of Environmental Sciences, Leiden University, Einsteinweg 2, Leiden, Netherlands; Cornelissen, J.H.C., Department of Ecological Science, Vrije Universiteit Amsterdam, De Boelelaan 1085, Amsterdam, Netherlands; Kattge, J., Max Planck Institute for Biogeochemistry, Hans Knöll Str. 10, Jena, Germany, German Centre for Integrative Biodiversity Research (iDiv) Halle-Jena-Leipzig, Deutscher Platz 5e, Leipzig, Germany; Laughlin, D.C., Environmental Research Institute, University of Waikato, Private Bag 3105, Hamilton, New Zealand; Niinemets, Ü., Department of Plant Physiology, Estonian University of Life Sciences, Kreutzwaldi 1, Tartu, Estonia; Peñuelas, J., CSIC, Global Ecology Unit, CREAF-CSIC-UAB, Cerdanyola del Vallès, Barcelona, Catalonia, Spain, CREAF, Cerdanyola del Vallès, Barcelona, Catalonia, Spain; Reich, P.B., Department of Forest Resources, University of Minnesota, St Paul, MN, United States, Hawkesbury Institute for the Environment, Western Sydney University, Penrith, NSW, Australia; Yguel, B., Unité MECADEV mécanismes adaptatifs et évolution, UMR 7179 CNRS/MNHN, 4 avenue du Petit Château, Brunoy, France, Centre d'Ecologie et des Sciences de la Conservation (CESCO-UMR 7204), Sorbonne Universités-MNHN-CNRS-UPMC, CP51, 55-61 rue Buffon, Paris, France; Wright, J.P., Department of Biology, Duke University, 130 Science Drive, Durham, NC, United States","Many exotic species have little apparent impact on ecosystem processes, whereas others have dramatic consequences for human and ecosystem health. There is growing evidence that invasions foster eutrophication. We need to identify species that are harmful and systems that are vulnerable to anticipate these consequences. Species’ traits may provide the necessary insights. We conducted a global meta-analysis to determine whether plant leaf and litter functional traits, and particularly leaf and litter nitrogen (N) content and carbon: nitrogen (C : N) ratio, explain variation in invasive species’ impacts on soil N cycling. Dissimilarity in leaf and litter traits among invaded and noninvaded plant communities control the magnitude and direction of invasion impacts on N cycling. Invasions that caused the greatest increases in soil inorganic N and mineralization rates had a much greater litter N content and lower litter C : N in the invaded than the reference community. Trait dissimilarities were better predictors than the trait values of invasive species alone. Quantifying baseline community tissue traits, in addition to those of the invasive species, is critical to understanding the impacts of invasion on soil N cycling. © 2016 The Authors. New Phytologist © 2016 New Phytologist Trust","functional trait; leaf carbon to nitrogen; leaf nitrogen content; mineralization; nitrogen cycling; nutrient-use strategy; plant invasions","biological invasion; biomineralization; carbon cycle; ecosystem dynamics; functional role; invasive species; leaf; leaf litter; meta-analysis; native species; nitrogen cycle; nutrient use efficiency; plant community; soil nitrogen; soil nutrient","Lee, M.R.; Department of Biology, Duke University, 130 Science Drive, United States; email: mrl17@duke.edu",,"Blackwell Publishing Ltd",0028646X,,NEPHA,,"English","New Phytol.",Article,Scopus,2-s2.0-84994559204
"Zvereva E.L., Zverev V., Kruglova O.Y., Kozlov M.V.","Strategies of chemical anti-predator defences in leaf beetles: is sequestration of plant toxins less costly than de novo synthesis?",2017,"Oecologia","183","1",,"93","106",,,10.1007/s00442-016-3743-x,"https://www.scopus.com/inward/record.uri?eid=2-s2.0-84990996802&doi=10.1007%2fs00442-016-3743-x&partnerID=40&md5=1d66154452b41e7a4a1369a8f7554213","Section of Ecology, Department of Biology, University of Turku, Turku, Finland; Faculty of Biology, Belarusian State University, Minsk, Belarus","Zvereva, E.L., Section of Ecology, Department of Biology, University of Turku, Turku, Finland; Zverev, V., Section of Ecology, Department of Biology, University of Turku, Turku, Finland; Kruglova, O.Y., Faculty of Biology, Belarusian State University, Minsk, Belarus; Kozlov, M.V., Section of Ecology, Department of Biology, University of Turku, Turku, Finland","The evolution of defensive traits is driven both by benefits gained from protection against enemies and by costs of defence production. We tested the hypothesis that specialisation of herbivores on toxic host plants, accompanied by the ability to acquire plant defensive compounds for herbivore defence, is favoured by the lower costs of sequestration compared to de novo synthesis of defensive compounds. We measured physiological costs of chemical defence as a reduction in larval performance in response to repeated removal of secretions (simulating predator attack) and compared these costs between five species synthesising defences de novo and three species sequestering salicylic glucosides (SGs) from their host plants. Experiments simulating low predator pressure revealed no physiological costs in terms of survival, weight and duration of development in any of study species. However, simulation of high predation caused reduction in relative growth rate in Chrysomela lapponica larvae producing autogenous defences more frequently, than in larvae sequestering SGs. Still meta-analysis of combined data showed no overall difference in costs of autogenous and sequestered defences. However, larvae synthesising their defences de novo demonstrated secretion-conserving behaviour, produced smaller amounts of secretions, replenished them at considerably lower rates and employed other types of defences (regurgitation, evasion) more frequently when compared to sequestering larvae. These latter results provide indirect evidence for biosynthetic constraints for amounts of defensive secretions produced de novo, resulting in low defence effectiveness. Lifting these constraints by sequestration may have driven some leaf beetle lineages toward sequestration of plant allelochemicals as the main defensive strategy. © 2016, Springer-Verlag Berlin Heidelberg.","Energetic costs; Fitness; Insects; Meta-analysis; Plant-herbivore interactions","allelochemical; antipredator defense; beetle; fitness; growth rate; herbivore; host plant; meta-analysis; plant defense; plant-herbivore interaction; specialization; toxin; Chrysomela lapponica; Chrysomelidae; Hexapoda; animal; beetle; evolution; herbivory; larva; meta analysis; plant leaf; Animals; Beetles; Biological Evolution; Herbivory; Larva; Plant Leaves","Zvereva, E.L.; Section of Ecology, Department of Biology, University of TurkuFinland; email: elezve@utu.fi",,"Springer Verlag",00298549,,OECOB,27718063,"English","Oecologia",Article,Scopus,2-s2.0-84990996802
"Xiao Z., Wang X., Koricheva J., Kergunteuil A., Le Bayon R.-C., Liu M., Hu F., Rasmann S.","Earthworms affect plant growth and resistance against herbivores: A meta-analysis",2017,"Functional Ecology",,,,"","",,,10.1111/1365-2435.12969,"https://www.scopus.com/inward/record.uri?eid=2-s2.0-85029212215&doi=10.1111%2f1365-2435.12969&partnerID=40&md5=616112fb3084890e91caf70bad46dcf3","Soil Ecology Lab College of Resources and Environmental Sciences Nanjing Agricultural University Nanjing China; Institute of Biology University of Neuchâtel Neuchatel Switzerland; Soil and Fertilizer Research Institute Sichuan Academy of Agricultural Sciences Chengdu China; School of Biological Sciences Royal Holloway University of London Egham UK; Jiangsu Collaborative Innovation Center for Solid Organic Waste Resource Utilization Nanjing China","Xiao, Z., Soil Ecology Lab College of Resources and Environmental Sciences Nanjing Agricultural University Nanjing China, Institute of Biology University of Neuchâtel Neuchatel Switzerland; Wang, X., Soil and Fertilizer Research Institute Sichuan Academy of Agricultural Sciences Chengdu China; Koricheva, J., School of Biological Sciences Royal Holloway University of London Egham UK; Kergunteuil, A., Institute of Biology University of Neuchâtel Neuchatel Switzerland; Le Bayon, R.-C., Institute of Biology University of Neuchâtel Neuchatel Switzerland; Liu, M., Soil Ecology Lab College of Resources and Environmental Sciences Nanjing Agricultural University Nanjing China, Jiangsu Collaborative Innovation Center for Solid Organic Waste Resource Utilization Nanjing China; Hu, F., Soil Ecology Lab College of Resources and Environmental Sciences Nanjing Agricultural University Nanjing China, Jiangsu Collaborative Innovation Center for Solid Organic Waste Resource Utilization Nanjing China; Rasmann, S., Institute of Biology University of Neuchâtel Neuchatel Switzerland","Subterranean detritivores such as earthworms can increase soil nutrient availability through their burrowing and casting activities. A number of recent studies have explored whether these changes caused by earthworms may in turn affect plant performance and resistance to herbivores, but no formal synthesis of this literature has been conducted to date. We tested for the effects of earthworms on plant growth, resistance and chemical defences against insect herbivores by performing a meta-analysis of the existing literature up to 2016. We also explored ecological factors that might explain among-studies variation in the magnitude of the earthworm effects on plant growth and resistance. We found that earthworm presence increases plant growth (by 20%) and nitrogen content (by 11%). Overall, earthworms did not affect plant resistance against chewing herbivores (caterpillars, slugs and rootworms), and even led to a 22% decrease in plant resistance against phloem-feeding herbivores (aphids). However, earthworm presence increased production of chemical defences by 31% when plants where attacked by cell-feeders (thrips), and resulted in an 81% increase in resistance against thrips. The magnitude of earthworm effects was stronger when earthworm inoculations consisted of a mix of species and ecological types, and when densities of earthworms were high. These results suggest that earthworm presence is an important factor underlying natural variation in plant defences against herbivores, and call for a better integration of the soil fauna in the studies of plant-herbivore interaction, both for applied and fundamental research. A plain language summary is available for this article. © 2017 British Ecological Society.","Chemical defences; Detritivore diversity; Endogeic earthworms; Herbivore-feeding guilds; Meta-analysis; Plant growth-defence trade-off; Plant nutrients; Plant resistance",,"Liu, M.email: liumq@njau.edu.cn",,"Blackwell Publishing Ltd",02698463,,FECOE,,"English","Funct. Ecol.",Article in Press,Scopus,2-s2.0-85029212215
"Camenzind T., Hättenschwiler S., Treseder K.K., Lehmann A., Rillig M.C.","Nutrient limitation of soil microbial processes in tropical forests",2017,"Ecological Monographs",,,,"","",,1,10.1002/ecm.1279,"https://www.scopus.com/inward/record.uri?eid=2-s2.0-85034223648&doi=10.1002%2fecm.1279&partnerID=40&md5=91b4e87b268f0f80346ac52c6f415ee7","Institute of Biology Freie Universität Berlin Altensteinstr. 6 14195 Berlin Germany; Berlin-Brandenburg Institute of Advanced Biodiversity Research (BBIB) 14195 Berlin Germany; Centre d'Ecologie Fonctionnelle et Evolutive (CEFE) UMR 5175 CNRS, Université de Montpellier, Université Paul-Valéry Montpellier, EPHE 1919 route de Mende 34293 Montpellier Cedex 5 France; School of Biological Sciences University of California Irvine 92697California USA","Camenzind, T., Institute of Biology Freie Universität Berlin Altensteinstr. 6 14195 Berlin Germany, Berlin-Brandenburg Institute of Advanced Biodiversity Research (BBIB) 14195 Berlin Germany; Hättenschwiler, S., Centre d'Ecologie Fonctionnelle et Evolutive (CEFE) UMR 5175 CNRS, Université de Montpellier, Université Paul-Valéry Montpellier, EPHE 1919 route de Mende 34293 Montpellier Cedex 5 France; Treseder, K.K., School of Biological Sciences University of California Irvine 92697California USA; Lehmann, A., Institute of Biology Freie Universität Berlin Altensteinstr. 6 14195 Berlin Germany, Berlin-Brandenburg Institute of Advanced Biodiversity Research (BBIB) 14195 Berlin Germany; Rillig, M.C., Institute of Biology Freie Universität Berlin Altensteinstr. 6 14195 Berlin Germany, Berlin-Brandenburg Institute of Advanced Biodiversity Research (BBIB) 14195 Berlin Germany","Soil fungi and bacteria are the key players in the transformation and processing of carbon and nutrients in terrestrial ecosystems, yet controls on their abundance and activity are not well understood. Based on stoichiometric principles, soil microbial processes are expected to be limited by mineral nutrients, which are particularly scarce in often highly weathered tropical forest soils. Such limitation is directly relevant for the fate of soil carbon and global element cycles, but its extent and nature have never been assessed systematically across the tropical biome. Here, we address the relative importance of nitrogen, phosphorus, and other nutrients in limiting soil microbial biomass and process rates in tropical forests. We conducted an in-depth literature review and a meta-analysis of the available nutrient addition experiments in tropical forests worldwide. Our synthesis showed predominant and general phosphorus limitation of a variety of microbial processes across tropical forests, and additional nitrogen limitation in tropical montane forests. The apparent widespread microbial phosphorus limitation needs to be accounted for in the understanding and prediction of biogeochemical cycles in tropical forests and their future functioning. Other mineral nutrients or carbon may modify the importance of phosphorus, but more experimental studies are urgently needed. © 2017 Ecological Society of America.","Meta-analysis; Mineral elements; Nitrogen; Nutrient limitations; Phosphorus; Soil microbes; Tropical forests",,"Camenzind, T.email: tessac@zedat.fu-berlin.de",,"Ecological Society of America",00129615,,ECMOA,,"English","Ecol. Monogr.",Article in Press,Scopus,2-s2.0-85034223648
